{
  "id": "nest-field-critical",
  "name": "현장검증 데모 - 위험 배치",
  "width_cm": 800,
  "height_cm": 600,
  "min_passage_cm": 80,
  "exit_clearance_cm": 100,
  "doors": [],
  "furniture": [
    {
      "id": "sharp-cabinet",
      "name": "높은 모서리 수납장",
      "rect": {
        "x": 300,
        "y": 250,
        "width": 100,
        "height": 100
      },
      "movable": true,
      "height_cm": 120,
      "blocks_view": true,
      "sharp_edge": true
    }
  ],
  "teacher_positions": [
    {
      "x": 100,
      "y": 300
    }
  ],
  "observation_points": [
    {
      "x": 430,
      "y": 300
    }
  ]
}
